{"id":"PM-ASSUMPTION-6001","next_review_at":"2026-11-01T00:00:00Z","owner":"ITDO Inc.","rationale":"The fixture performs structural binding and does not independently authenticate the upstream authority.","record_type":"assumption","reviewed_at":"2026-08-01T00:00:00Z","schema_version":"0.1","scope":"Fixture Protocol/conformance metadata binding.","sources":["https://github.com/itdojp/private-match-protocol/commit/9bb59d3b5e1435885fdea60280d6602f937305c9"],"statement":"The committed reviewed Protocol authority file is the intended authority for this synthetic fixture.","status":"active"}